,text,depression_level
943,"Quiero llorar, pero ya no salen lágrimas, quiero gritar, y mi voz se quiebra. Necesito desaparecer.",1 star
944,6:56 am. El insomnio dejo de ser una simple etapa desde las 3 am de 2014,1 star
945,Ansiedad.,3 stars
946,"Me siento igual que hace 4 años. Solo, vacío, inútil.",1 star
947,No sé que hacer con mi vida.,5 stars
948,Me siento tan mal que no puedo fingir no estarlo.,1 star
949,Estrés.,3 stars
950,Me duele mucho el alma.,5 stars
951,Estoy cansada de todo y de todos ojala esto fuera una pesadilla de la que pueda despertar...,1 star
952,Que baajoon,1 star
953,Aveces tengo miedo de mi misma!😳,5 stars
954,Acompañada o no me siento sola igual,3 stars
955,No puedo mas😥,2 stars
956,La vida misma me empuja hacia la muerte,5 stars
957,La vida es una mierda y los que te quieren solo lo empeoran,2 stars
958,Ya no puedo mas EXTERNAL_LINK,2 stars
959,Me aferro al mañana pero mi pasado me persigue.....,3 stars
960,yo no se la vida me odia :((,1 star
961,Me siento más sola y patética que nunca.,2 stars
962,"Me veo horrible, estoy triste e intratable, me siento usada y pisoteada, no quiero salir de mi casa, solamente quiero morirme.",2 stars
963,No me quieren en ningún lado y solamente tengo ganas de desaparecer.,2 stars
964,"Nunca sé que hacer ante los problemas, no tengo reacción.",2 stars
965,No puedo creer que necesite una pastilla de mierda para sentirme bien.,3 stars
966,No sé que hacer y estoy atrapada.,5 stars
967,Estoy tan cansada de que la gente a mi alrededor no me haga sentir nada.,2 stars
968,"Siempre estoy al borde del llanto, incluso cuando estoy de buen humor.",5 stars
969,"Mis estabilizadores de ánimo tienen un mejor efecto cuando recién los empezas a tomar, entonces, no los tomo por un… EXTERNAL_LINK",3 stars
970,No puedo estar tranquila nunca. Tengo tantas ganas de morirme.,2 stars
971,"Maduré desde el 2015 a ahora, pero estoy todavía más deprimida.",3 stars
972,Me siento tan desprotegida.,2 stars
973,"Siento la necesidad de lastimarme, que mierda loco estoy tan cansada de sentirme así, no quiero más esto",2 stars
974,Estoy muy sensible últimamente no me soporto,2 stars
975,"Estoy tan harta que ni llorar me sale pero tengo tanta rabia y tristeza que mejor me voy a dormir, así evito mandarme cagadas",2 stars
976,Que mal me hace todo que mal me hace todo que mal me hace todo que mal me hace todo,2 stars
977,Tengo que hacer varias cosas pero no tengo nada de energía y encima estoy triste,2 stars
978,Trato de no pensar en cosas feas para estar al menos un poquito bien pero aunque no piense el sentimiento de tristeza y vacío nunca se va,2 stars
979,No sé q estoy esperando para matarme,2 stars
980,Que insoportable es mi existencia,2 stars
981,"Me siento tan hundida, tan incapaz, me da tanta rabia ser yo, tanta impotencia no poder",2 stars
982,Que asco existir,2 stars
983,"Me siento como si fuera a estallar.Todo el estrés, la presión y la ansiedad burbujeando, pero nunca soy capaz de sacarlo.Sólo sigue adentro.",2 stars
984,Mi mamá está criticando la depresión y diciendo que tiene derecho a hacerlo porque ella lo pasó. Si supiera que yo entiendo de lo que habla.,2 stars
985,A mi nunca nada me puede salir bien.,2 stars
986,"Sólo tengo ganas de llorar, pero llorar en la facultad no es una opción.",3 stars
987,Estoy sensible y me siento una estúpida porque todo me pone mal.,2 stars
988,Un día de estos voy a explotar y sacar todo lo que he guardado durante tanto tiempo. Y quién sabe? Talvés todo acabe luego de eso.,2 stars
989,Es increíble que hasta con mis amigas me termino quedando sola. Ya no soporto que me ignoren.,5 stars
990,No quiero hacer nada,2 stars
991,Quiero morirme,2 stars
992,NO ME APETECE VIVIR,1 star
993,Con ganas de morirme,5 stars
994,"Hay gente que no entiende que el suicidio si es una opción, a veces la única visible",2 stars
995,NO PUEDO,1 star
996,De nuevo vacío,1 star
997,SOY GAY SOY GAY SOY GAY SOY GAY SOY PUTAMENTE GAY SOY ASQUEROSAMENTE GAY SOY una mierda,2 stars
998,Cansado si muy cansado de todo de la gente y de la vida,1 star
999,LA VIDA ME MATAA,1 star
1000,Cansado,1 star
